Platform,Date,Title,Genre,Company,Metascore,Userscore,Summary
PC,"May 31, 2007",Halo 2,"['Action', 'Arcade', 'First-Person', 'Sci-Fi', 'Shooter']",Microsoft Game Studios,72,6.2,"The saga continues with Halo 2 the international award-winning sequel to the highly successful and critically acclaimed Halo: Combat Evolved. In this sequel, the battle comes to Earth, and Master Chief, a genetically enhanced super soldier, is the only thing standing between the relentless alien Covenant and the destruction of all humankind. Exciting Single-Player Gameplay: Experience first hand the epic struggle between Master Chief and the Covenant armada. Brandish dual-wield weapons Covenant arms and pilot human and non-human vehicles and aircraft to battle intelligent AI alien enemies. Halo 2 for Windows Vista taps into the power of Live Anywhere, a service similar to Xbox Live, to deliver online matchmaking for PC gamers. The service enables Windows Vista gamers all over the globe to connect via their PCs and play on an innovative and competitive online forum. New Multiplayer Map Editor: The game also features the all-new new Map Editor, guaranteeing additional new, fan-generated content in the future. The Halo 2 community can now tap their endless creative potential to develop an unlimited number of user-created multiplayer levels. Complete Community Freedom: Halo 2 for Windows Vista offers gamers the freedom to host their own dedicated servers for maximum multiplayer action. [Microsoft]"
PC,"Apr  2, 2013",Cities in Motion 2,"['General', 'Simulation']",Paradox Interactive,72,7.2,"Cities in Motion 2 is the sequel to the popular mass transit simulation game Cities in Motion. The Modern Days introduces new features, like multiplayer game modes, day and night cycle, timetables and dynamic cities. The player's actions in building the transportation network will affect how the city grows, with affordable transportation spawning middle class housing and work places, and more expensive and delicate choices bringing in demanding business people. Player has many different types of vehicles to choose from and now can also build roads with bus lanes. Tackling the rush hour by managing transportation timetables and meeting the needs of the citizens are one of the key elements of building a successful and efficient network!"
PC,"Sep 27, 2019",FIFA 20,"['Sim', 'Soccer', 'Sports', 'Team']",Electronic Arts,72,1.3,"Enjoy more control over the Decisive Moments that determine the outcome of every match in FIFA 20. Pick your target and time it right from the spot. Add curl, dip, or knuckle to free kicks. A new aiming mechanic gives you more creativity from dead balls. Move with more agility. Lure the defender in. Beat them with speed or skill. New strafe dribbling adds new dimensions for attacking play in FIFA 20. Take back possession with Active Touch Tackling and new animations that reward you for well-timed defensive play. More clinical finishing when one-on-one. More risk with volleys and long shots. Overhauled shooting creates more realism in front of goal in FIFA 20. [Electronic Arts]"
PC,"Nov  5, 2021",Call of Duty: Vanguard,"['Action', 'First-Person', 'Shooter', 'Tactical']",Activision,72,3.3,"This is WWII combat like never before. Witness the origins of Special Forces as you play a pivotal role and change the face of history, forming Task Force One in a gripping Campaign across four major theaters of war. Become an original Special Forces Operator in an online Multiplayer rich in innovation with 20 maps available at launch. Prepare for a franchise-first, universe-expanding Zombies crossover. Immerse yourself in a fully integrated Call of Duty®: Warzone™ experience featuring a new and massive map. This is the most connected Call of Duty ever, all powered by the next generation Call of Duty® engine introduced in Modern Warfare."
PC,"Aug 22, 2017",Marvel's Guardians of the Galaxy - Episode 3: More Than A Feeling,"['3D', 'Action', 'Adventure', 'General', 'Third-Person']",Telltale Games,72,7.1,"In the wake of an epic battle, the Guardians discover an artifact of unspeakable power. Each of the Guardians has a reason to desire this relic, as does a ruthless enemy who will stop at nothing to tear it from their hands. From Earth to the Milano to Knowhere and beyond, this five-part episodic series puts you in the rocket-powered boots of Star-Lord in an original Guardians adventure."
PC,"Apr 13, 2006",Auto Assault,"['Massively Multiplayer', 'Massively Multiplayer Online', 'Role-Playing', 'Sci-Fi']",NCSOFT,72,7.9,"Combine fast-paced vehicular combat with high-tech, futuristic weaponry and hundreds of intense skills and you get Auto Assault -- a unique departure from traditional Massively Multiplayer Online Role Playing Games (MMORPGs). Hop in your own customized cars, semis, and motorcycles and prepare to fight the mutated creatures and bandits of Auto Assault's post-apocalyptic world. Battle other players both in arenas and in epic race vs. race wars for control of the regions in a devastated Earth. Auto Assault uses the power of the Havok physics engine to let you make insane jumps, send obstacles flying and even blast bridges, buildings, fences and trees with your car-mounted rockets. Anything you can hit, you can destroy. [NCsoft]"
PC,"Nov 18, 2003",XIII,"['Action', 'Arcade', 'First-Person', 'Modern', 'Sci-Fi', 'Shooter']",Ubisoft,72,7.7,"The President of the United States of America has been assassinated. You wake up on a desolate strip of New England beach. The near-fatal impact of a bullet has left your head pounding, and your memory erased. What's more, the number ""XIII"" has been mysteriously tattooed on your chest, while your pocket holds a key to a New York City bank box. Head swimming in amnesia, you struggle to your feet only to encounter more assailants intent on finishing the job. To your shock, you handle the hitmen with the killing skills of a professional - before heading to the bank in search of any shred of information about your lost identity and your involvement in the President's murder. What lies ahead is a deadly quest not only into your shadowy past, but America's darkest corridors of power. [Ubi Soft]"
PC,"May 12, 2014",The Last Tinker: City of Colors,"['3D', 'Action', 'Platformer']",Unity Games,72,6.5,"The indie-developed rebirth of platform games."
PC,"Jun  4, 2018",Vampyr,"['Action RPG', 'General', 'Role-Playing']",Focus Home Interactive,72,6.8,"Vampyr is set in early 20th century Britain as the country is gripped by the lethal Spanish flu and the streets of London are crippled by disease, violence and fear. In a disorganized and ghostly city, those foolish, desperate, or unlucky enough to walk the streets lay prey to Britain’s most elusive predators: the vampires. Emerging from the chaos, a tormented figure awakens. You are Jonathan E. Reid, a high-ranking military surgeon transformed into a vampire upon his return home from the frontline.  Explore the darkly atmospheric streets of early 20th century London, and interact with a multitude of characters with their own identities and importance. Accept and fulfill the missions they give you, but don’t forget: sooner or later, you will have to feed, and make a difficult choice... who will be your prey? Absolutely all characters in the game are potential victims of your vampiric lust. Carefully study the habits of your next victim, his or her relationships with other characters, and set up your strategy to feed, unnoticed: seduce them, change their daily habits, or make sure they end up alone in a dark street…  Be careful who you choose to hunt, as they will be gone forever, and their death will impact in a meaningful way the world that surrounds you. Feeding on human blood will not just keep you 'alive;' it will also unlock new vampiric powers to use. [Focus Home]"
PC,"Nov  6, 2020",DIRT 5,"['Automobile', 'Racing', 'Simulation']",Deep Silver,72,4.2,"Take a trip around the world to and race on over 70+ unique routes across 10 different global locations in stunning environments complete with dynamic weather and time of day. Get behind the wheel of an eclectic and exciting roster of cars. World-renowned voice talents troy baker and nolan north head up the cast of dirt 5's story-driven Career mode. Local split-screen of up to four players on offline modes, including Career, makes dirt 5 the perfect couch multiplayer racing game as you battle for position with your friends. Capture your biggest jumps and best moves with a detailed photo mode, and show your creative flair with dirt's deepest ever livery editor for all cars."
PC,"Oct 29, 2020",Watch Dogs: Legion,"['Action Adventure', 'Open-World']",Ubisoft,72,5.5,"In the near future, London is facing its downfall: the people are being oppressed by an all-seeing surveillance state, a corrupt private military corporation controls the streets, and a powerful crime syndicate is preying on the vulnerable. The fate of London lies with you, and your ability to recruit a resistance and fight back."
PC,"Sep  9, 2019",GreedFall,"['Action RPG', 'Role-Playing']",Focus Home Interactive,72,7.5,"Explore uncharted new lands as you set foot on a remote island seeping with magic, and filled with riches, lost secrets, and fantastic creatures. Forge this new world's destiny, as you befriend or betray companions and entire factions. With diplomacy, deception and force, become part of a living, evolving world - influence its course and shape your story."
PC,"Jun  5, 2018",Far Cry 5: Hours of Darkness,"['Action', 'Arcade', 'First-Person', 'Shooter']",Ubisoft,72,4.4,"Wendell Redler is more than just a Hope County resident, he's a veteran soldier of the Vietnam War. Listen to him recount his glory days as you travel back in time to war-torn Vietnam to take down Viet-Cong. Trapped behind enemy lines, rescue your squad mates and evacuate to safety in the first war-based far cry. You must maneuver throughout this remote valley in Vietnam, and use survival instinct and stealth to save your team and get home. [Ubisoft]"
PC,"Nov  8, 2019",Need for Speed Heat,"['Arcade', 'Automobile', 'Racing']",Electronic Arts,72,5.5,"Hustle by day and risk it all at night in Need for Speed Heat, a white-knuckle racer that pits you against a city's rogue police force as you battle your way into street racing's elite. By day compete in the Speedhunter Showdown -- a sanctioned competition where you earn bank to customize and upgrade your garage of high-performance cars. When your ride's perfectly styled and hyper-tuned, and you're ready to ramp up the intensity, drive out into the night where you and your crew take on the competition in illicit street races that build your reputation and grant you access to bigger races and better parts. But under the cover of darkness patrols a rogue task force looking to bring you down and swipe all you've earned. Take them on and risk it all for underground glory or head back to your safehouse and begin another thrilling day. The roads, the risks, and the rides never end in this street racer where your crew rolls deep, your garage is full of hot cars, and the city's your nonstop playground."
PC,"Sep 26, 2019",Code Vein,"['Action RPG', 'Role-Playing']",Bandai Namco Games,72,7.6,"In the not too distant future, a mysterious disaster has brought collapse to the world as we know it. Towering skyscrapers, once symbols of prosperity, are now lifeless graves of humanity's past pierced by the Thorns of Judgment. At the center of the destruction lies a hidden society of Revenants called Vein. This final stronghold is where the remaining few fight to survive, blessed with Gifts of power in exchange for their memories and a thirst for blood. Give into the bloodlust fully and risk becoming one of the Lost, fiendish ghouls devoid of any remaining humanity. Wandering aimlessly in search of blood, the Lost will stop at nothing to satisfy their hunger. Team up and embark on a journey to the ends of hell to unlock your past and escape your living nightmare in Code Vein."
PC,"Jul 28, 2016",Total War: WARHAMMER - Call of the Beastmen,"['General', 'Strategy', 'Turn-Based']",Sega,72,4.5,"The Call of The Beastmen Campaign Pack introduces the Beastmen as a playable race to Total War: WARHAMMER. A feral, Chaos-tainted horde race, they move like a plague across The Old World, fielding half-human aberrations and colossal beasts in battle, many of which feature unique abilities. The Beastmen are playable in the Grand Campaign, custom and multiplayer battles, and in their very own Story Campaign, An Eye For An Eye."
PC,"Dec  3, 2003",X2: The Threat,"['Combat', 'Sci-Fi', 'Simulation', 'Small Spaceship', 'Space']",Enlight Software,72,7.2,"X2: The Threat offers players a rich storyline and a boundless game play universe. In X2, the player takes on the role of a pilot indigenous to the X-Universe. The story unfolds as the soon-to-be hero and his companion attempt to steal a ship. After a failed, action-packed escape, he soon finds himself aboard a security ship and destined to live out his days on the cold, prison-mining world of Artur. With a dynamic universe and a plot expertly weaved together the story of The Threat is sure to intrigue players of various genres."
PC,"Dec  1, 2014",The Crew,"['Automobile', 'Driving', 'GT / Street', 'Racing', 'Simulation']",Ubisoft,71,6.3,"Engage in a relentless ride to infiltrate and subvert the 510s, a gang that has come to power around Detroit's illegal street racing scene. Your mission? Build up your reputation in the secret racing scene and sabotage their activities city-by-city all across an open world United States. Maneuver through the crackling streets of New York City and Los Angeles, drive through sunny Miami Beach, or trek through the grand plateaus of Monument Valley. Each location comes with its own set of surprises and driving challenges to master. On your journey you will encounter other people on the road - all potentially worthy companions to crew up with, or future rivals to compete against."
PC,"May 23, 2014",Killer Is Dead: Nightmare Edition,"['Action Adventure', 'General', 'Sci-Fi']",Deep Silver,71,6.4,"Killer Is Dead is the latest title from the demented mind of celebrated game creator, SUDA51, serving as a spiritual successor to his previous cult favorites, No More Heroes and Killer 7. Stylish cel-shaded visuals set the mood in this gritty, bloody, ultra-violent world where biomechanical augmentations increase the power of criminals and ""executioners"" alike. Mondo Zappa, a newly recruited executioner, hunts criminals wielding a Japanese sword in his right hand, and the crushing power of biomechanical engineering in his left."
PC,"Jun 10, 2021",Ninja Gaiden: Master Collection,"['Compilation', 'Miscellaneous']",Koei Tecmo Games,71,4.1,"Three extremely high speed and intense ninja action games are now available in one package. Enjoy 3 games from the NINJA GAIDEN series in this single collection.  The nostalgic yet timeless high-speed action of the series unfolds on the latest hardware, so look forward to heated battles with fearsome opponents. In addition to Ryu Hayabusa, the 4 female characters Ayane, Rachel, Momiji, and Kasumi are also playable. Pair up favorite characters, and switch between characters during battles. The heroines included in this title are the same as the original versions. In addition, the characters that are playable and scenes (modes) vary for each title."
PC,"Aug 14, 2006",DarkStar One,"['Combat', 'Sci-Fi', 'Simulation', 'Small Spaceship', 'Space']",cdv Software,71,7.2,"DarkStar One is an open-ended action/adventure title set in a huge universe populated by a variety of unique alien races. Players will take on the role of an intrepid young adventurer, Kayron Jarvis, as he explores space, upgrading and customizing his ship – the DarkStar One. The game's story, written by renowned German Fantasy and Science Fiction author Claudia Kern, will immerse players in a tale of action and intrigue as Kayron searches for answers surrounding the death of his father. Players can take a number of different paths and approaches to earn money and upgrades as they solve the mystery of the death of Kayron's father. One may play as trader, mercenary, smuggler, pirate or a combination thereof, customizing tactics to suit individual playing styles. A fully customizable and upgradeable ship – the DarkStar One. Players can create a fast attack boat, heavy cruiser or other combined style of ship from parts purchased or captured from enemies. More than 200 weapons, shields and equipment upgrades -- including rockets, torpedoes and mines, each featuring a special tactical or trade benefit. [CDV Software]"
PC,"Dec  2, 2002",Shadow of Destiny,"['3D', 'Adventure', 'Fantasy', 'Third-Person']",Konami,71,7.7,"A murder has been committed... your own! Travel back in time to solve thought provoking puzzles as you unravel the mystery of your death. See how your actions in the past change the course of events in the future. You have the power to prevent your death, identify your killer, and change your destiny. Use it wisely. [Konami]"
PC,"Dec 14, 2010",Europa Universalis III: Divine Wind,"['General', 'Strategy']",Paradox Interactive,71,8.7,"The fourth expansion to the classic historical strategy epic, Europa Universalis III Divine Wind is set in the Far East and will enhance every aspect of the original game to create an even deeper and more rewarding experience. Requiring Europa Universalis III Complete as well as the Heir to the Throne expansion to play, Divine Wind introduces a new graphical style, a more detailed map, and a wealth of new oriental provinces to control."
PC,"Feb 18, 2013",March of the Eagles,"['General', 'Real-Time', 'Strategy']",Paradox Interactive,71,7.0,"The wargame March of the Eagles is dedicated to the era 1805-1815 focused on the dramatic conflicts of Europe. March of the Eagles explores one of the defining periods in European history in an experience crafted by Paradox Development Studio, the masters of Grand Strategy and makers of Hearts of Iron and Europa Universalis. The Napoleonic War is brought to life in this war-focused strategy game."
PC,"Sep 18, 2018",The Bard's Tale IV: Barrows Deep,"['General', 'Role-Playing', 'Western-Style']",InXile Entertainment,71,6.5,"The Bard's Tale IV returns to the classic fantasy RPGs of years past. Featuring dynamic turn-based combat, a full party of characters to build and customize, and first-person exploration of maze-like dungeons with devious puzzles and riddles, The Bard's Tale IV is a true successor to the original Bard's Tale trilogy, and is crowdfunded by thousands of fans. Help us bring back the dungeon crawl and return to Skara Brae - the city that started it all."
PC,"Jun 26, 2012",Tom Clancy's Ghost Recon: Future Soldier,"['Action', 'Modern', 'Shooter', 'Tactical', 'Third-Person']",Ubisoft,71,5.2,"Developed by the team behind Tom Clancy's Ghost Recon Advanced Warfighter and Tom Clancy's Ghost Recon Advanced Warfighter 2, the game features cutting-edge technology, prototype high-tech weaponry, and state-of-the-art single-player and multiplayer modes. Tom Clancy's Ghost Recon: Future Soldier goes beyond the core Ghost Recon franchise and deliver a fresh gameplay experience."
PC,"Mar 17, 2015",Battlefield Hardline,"['Action', 'Arcade', 'First-Person', 'Modern', 'Shooter', 'Tactical']",Electronic Arts,71,4.2,"Run your crew as detective Nick Mendoza in an episodic crime drama single player campaign or as cops and criminals in rapid Battlefield multi-player. You will be on one side of the thin blue line or the other. Assume control using new tactics to gather intelligence, obtain warrants and takedown with non-lethal force to effectuate the arrests. Take the cash in a new battlefield playground. New maps and gadgets alter the way you play the game. Utilize grappling hooks and zip-lines to scale city buildings and fly across the city with the cheddar. No matter the strategy, teamwork is key to winning the turf war. Sate your need for speed in  new action-packed modes. Hop in exotic muscle cars, sleek crotch rockets or even give your whole crew a lift in transports or armored trucks."
PC,"Oct 16, 2020",9 Monkeys of Shaolin,"['3D', 'Action', ""Beat-'Em-Up""]",Buka Entertainment,71,7.5,"9 Monkeys of Shaolin  marks a rebirth of the iconic beat 'em up genre in vein of old-school video games. If, as a kid you had hours of fun playing SNES or SEGA beat 'em up videogames crushing foes left and right then this new title from the creators of hardcore brawler REDEEMER is definitely for you. As a mere Chinese fisherman Wei Cheng you have to avenge the death of your friends and family slaughtered in a pirate raid at your peaceful village. Game protagonist is quite a tough nut to crack as he knows the basics of ancient martial arts only mastered by legendary Shaolin monks. Get your trusty battle staff ready for a challenging adventure in Medieval China and for merciless fights with hordes of various enemies. Action-packed battles, user friendly controls and incredible atmosphere of great kung-fu movies of 70s – all this makes 9 Monkeys of Shaolin a choice for every true fan of really hardcore brawlers."
PC,"Mar  1, 2022",Shadow Warrior 3,"['Action', 'Arcade', 'First-Person', 'Shooter']",Devolver Digital,71,6.1,"Shadow Warrior 3 launches the offbeat first-person shooter series to the next level with a seamless blend of fast-paced gunplay, razor-sharp melee combat, and a spectacular free-running movement system. Fallen corporate shogun Lo Wang and his former employer turned nemesis turned sidekick Orochi Zilla embark on an improbable mission to recapture an ancient dragon they unwillingly unleashed from its eternal prison. Armed with a punishing mix of blades and bullets, Lo Wang must traverse uncharted parts of the world to track down the dark beast and push the apocalypse back yet again. All it will take is the mask of a dead god, a dragon's egg, a touch of magic, and enough firepower to hold off the impending cataclysm. Bring a Katana to a Gunfight. Conduct a symphony of death with each encounter by mixing overwhelming firepower with devastatingly precise katana strikes as you dash in and around the demonic hordes."
PC,"Jan 20, 2022",Tom Clancy's Rainbow Six Extraction,"['Action', 'First-Person', 'Shooter', 'Tactical']",Ubisoft,71,4.7,"Assemble your elite team of Rainbow Six Operators to launch incursions in the unpredictable containment zones and face off against an evolving Alien threat. Band together and put everything on the line as you take on this unknown enemy. Pick from 18 Rainbow Six operators. Assemble a squad in Co-op of up to three Operators, or go solo. Each operator has a specific set of weapons and abilities to learn improve and master, and improve through a new progression-system. Explore 12 uniquely designed maps featuring procedurally generated challenges will test your team every time. Knowledge, cooperation and a tactical approach are your best weapons to survive. Fail against the enemies and your Operators will go Missing in Action (MIA). Be prepared to fight a lethal, unpredictable and constantly evolving Alien Threat. You will have to count on your teammates to face each of the 10 parasitic archetypes. Their abilities, combined with the alien ecosystem, will stand in your way."
PC,"Sep  4, 2018",Zone of the Enders: The 2nd Runner MARS,"['Combat', 'Simulation', 'Vehicle']",Konami,71,6.7,"JEHUTY lives. And there, ANUBIS thrives. Zone of the Enders: The 2nd Runner returns with 4K and VR support on Steam."
PC,"May 13, 2014",Dynasty Warriors 8: Xtreme Legends Complete Edition,"['3D', 'Action', ""Beat-'Em-Up""]",Tecmo Koei Games,71,7.2,"'Dynasty Warriors 8: Xtreme Legends' introduces entirely new levels of fun to the refreshing gameplay vanquishing swarms of enemies with mighty warriors found in 'Dynasty Warrors 8.' In story mode, where you can immerse yourself in the vivid tales of the Romance of the Three Kingdoms, it is now possible to play as the mighty warrior 'Lu Bu,' and embark on a journey that depicts his way of life. Additionally, many new hypothetical scenarios to existing Romance of the Three Kingdoms battles have been added, as well as new playable characters, weapons types, growth/speedrun elements, and more! What's more, a revamped Ambition Mode and completely new Challenge Mode offer whole new ways to enjoy the 'Dynasty Warriors 8' universe."
PC,"Jul 28, 2020",Destroy All Humans!,"['Action Adventure', 'General']",THQ Nordic,71,7.7,The cult-classic returns! Terrorize the people of 1950s Earth in the role of the evil alien Crypto-137. Harvest DNA and bring down the US government in the remake of the legendary alien invasion action adventure. Annihilate puny humans using an assortment of alien weaponry and psychic abilities. Reduce their cities to rubble with your flying Saucer! One giant step on mankind.
PC,"Jul 18, 2000",KISS: Psycho Circus - The Nightmare Child,"['Action', 'Arcade', 'Fantasy', 'First-Person', 'Shooter']",Gathering,71,7.3,"Utilizing an enhanced version of the LithTech engine, KISS Psycho Circus comes alive with realistic character and object motions, and interactive music and sound effects. The game supports up to 50 creatures on the screen at once, the largest number of creatures on the screen at one time in a first-person game.  [Gathering of Developers]"
