Platform,Date,Title,Genre,Company,Metascore,Userscore,Summary
PC,"Oct 28, 2003",Gothic II,"['PC-style RPG', 'Role-Playing', 'Western-Style']",Atari,79,9.1,"Gothic II takes you on an even greater journey of adventure and discovery. The plot continues from the cliff-hanger of the original: After the imprisoned colony members are victorious, collapsing the magical barrier, the former Prison Colony is struck by a terrible earthquake, claiming the lives of many. The majority of survivors seize this opportunity to escape with only a handful of people remaining in the derelict prison."
PC,"Oct  2, 2018",Mega Man 11,"['2D', 'Action', 'Platformer']",Capcom,79,8.7,"Thirty years ago, in 1987, a super robot named Mega Man was created. In 2018 after 30 years of unforgettable adventures the fight for everlasting peace continues! The tight action-platformer gameplay that made the series a success is alive and well. To save the day, the Blue Bomber must battle Robot Masters and take their powerful weapons for himself, which now changes the hero's appearance with new levels of detail. A new, vivid visual style refreshes the series' iconic colorfulness, combining hand-drawn environments with detailed, 3D character models."
PC,"Dec  4, 2012",Waking Mars,"['2D', 'Action', 'Platformer']",Tiger Style,79,7.7,"In 2097, life is discovered on Mars. When your mission of first contact becomes trapped by a cave-in, you must master the alien ecosystem to survive. Soon you stumble upon more than anyone expected, and with time running out, you will make a decision that determines the fate of a lost planet."
PC,"Feb 16, 2016",Pillars of Eternity: The White March - Part 2,"['Role-Playing', 'Western-Style']",Paradox Interactive,79,7.5,"The White March – Part 2 not only adds new content to the Pillars of Eternity universe, but also allows players to experience the conclusion of the stories told in The White March – Part 1, bringing the first epic chapter of Pillars of Eternity to a close. Players will find a variety of new challenges waiting for them in the snowy borderlands of the Eastern Reach, along with new quests, new abilities and a raised level cap, and a new companion: Meneha, the Barbarian. [Obsidian]"
PC,"Aug 28, 2007",Guild Wars: Eye of the North,"['Compilation', 'General', 'Massively Multiplayer', 'Miscellaneous', 'Role-Playing']",NCSOFT,79,8.5,"Guild Wars players can embark on a journey that will take their existing characters into the treacherous reaches north of the Shiverpeak Mountains. There, they must stand side-by-side with both friends and enemies from the past, recruit new allies and heroes, and delve deep into perilous dungeons to face an ancient evil. The fate of the world hangs in the balance. One thing is certain; at the end of this battle, nothing will remain the same. In Guild Wars: Eye of the North, players encounter two new races: the enigmatic Asura, masters of magic who were driven from the depths by a great danger, and the fiercely independent Norn, who are more interested in contests of personal prowess than the troubles of the world around them. And as the Deldrimor Dwarves fight a desperate battle against a new evil welling up out of the earth, players once again come face-to-face with humanity's most-hated enemy—the Charr. Guild Wars: Eye of the North introduces another exciting feature to the Guild Wars legacy—multi-level dungeons. As the story of this expansion unfolds, players delve into eighteen vast dungeons to face untold enemies, search for clues about the menace facing the world, and uncover new weapons they can use in the final confrontation. These immersive, multi-level dungeons take characters deep beneath the earth and expose them to challenges the likes of which have never been seen in any Guild Wars game to date. [NCsoft]"
PC,"Sep 24, 2020",Mafia: Definitive Edition,"['Action Adventure', 'Open-World']",2K Games,79,6.8,"Part one of the Mafia crime saga - 1930s, Lost Heaven, IL Re-made from the ground up, rise through the ranks of the Mafia during the Prohibition era of organized crime. After a run-in with the mob, cab driver Tommy Angelo is thrust into a deadly underworld. Initially uneasy about falling in with the Salieri crime family, Tommy soon finds that the rewards are too big to ignore. "
PC,"Sep  4, 2003",Battlefield 1942: Secret Weapons of WWII,"['Action', 'Arcade', 'First-Person', 'Historic', 'Shooter']",EA Games,79,7.9,"In Secret Weapons of WWII, players will engage in war with a choice of up to 46 vehicles to control. In addition to the 30 vehicles introduced in the original game such as fighter planes, tanks, and aircraft carriers, players can operate 16 new vehicles including the Horton HO 229 ""Flying Wing"" that is equipped with 30 mm machine guns and missiles. Other vehicles consist of a US Sherman tank with a T-34 Calliope rocket launcher, U.S. T95/T28 Super Heavy Tank, the Sturmtiger (naval gun mounted on Tiger tank), U.S. Goblin jetfighter, C-47 cargo plane that will serve as a mobile spawn point, the American Armstrong Whitworth AW-52 advanced fighter, the German Wasserfall guided anti-air missile and the German Natter rocket plane. Also, for the first time, Secret Weapons of WWII will give players the chance to fly and fight at the same time with a top secret German prototype Rocket Pack. There will be seven new weapons including one-shot kill knives, the Bren light machine gun, Remington Auto 5 shotgun and the Mauser K98 grenade rifle. The game introduces British Commando and German Elite troops while enriching gameplay by adding a new ""objective based"" gameplay mode. [Electronic Arts]"
PC,"Jan 24, 2019",Life is Strange 2: Episode 2 - Rules,"['Action Adventure', 'General']",DONTNOD Entertainment,79,5.1,"The two brothers continue their journey into the winter months & struggle against the cold. As Daniel gradually falls ill, Sean decides they must make their way to their distant grandparent’s house to recover. During their stay, they encounter next-door neighbor Chris, a young boy who believes he is a superhero by the name of Captain Spirit."
PC,"Oct 18, 2011",The Sims 3: Pets,"['Miscellaneous', 'Simulation', 'Virtual', 'Virtual Life']",Electronic Arts,79,6.1,"Players take creativity by the reins and play out the stories they want to tell whether it’s the single guy in the dog park picking up women or the criminal overlord and her evil cat. Across all platforms, The Sims 3 Pets players will be able to create, customize and control over a hundred different kinds of cats and dogs like the Australian Shepherd and the Maine Coon, and can breed and share them with friends providing endless possibilities to create new and exciting breeds. Each platform brings a new world for players to explore from the Xbox 360 and PlayStation 3 versions where players will unlock achievements by solving mysteries around town, the Nintendo 3DS with new lots to unlock to the PC/Mac version where they’ll be able to take their pets on play dates or meet other Sims at the dog park, cat jungles and even a horse ranch. With The Sims 3 Pets, players will be able to create, control and play with life with their pets."
PC,"Jun 10, 2009",Prototype,"['Action Adventure', 'Open-World', 'Sci-Fi']",Activision,79,7.7,"You are Alex Mercer, the Prototype: a shapeshifter with amazing powers of combat, destruction, and deception. Consume targets for their form and memories to assume a perfect disguise, or instantly transform your body into an array of deadly biological weapons, cutting your way to the heart of the conspiracy forty years in the making. Stalk the streets of New York City, searching for the life you lead before. Take the form of anyone in your path, using an arsenal of identities to confound, exploit or annihilate your enemies. Mankind is your mask. Wage a secret war against factions with complex agendas of their own, out to capture or kill you. They are your greatest threat and the key to the secrets of your past. Confront them, find those responsible and make them pay. Shapeshifting: Attack with brutal and devastating powers; instantly triggering hundreds of power combinations (Attack, Defensive and Sensory). Disguise: Assume the perfect disguise by transforming into any character and assuming the victim's powers, skills and abilities. New York City is your hunting ground! Jam-packed, vibrant, fully interactive city filled with thousands of people and enemies out to destroy you. Delve to the bottom of a conspiracy that has haunted the American government for decades. Who is responsible for your condition? Only you can find out!"
PC,"May 11, 2012",Street Fighter X Tekken,"['2D', '3D', 'Action', 'Fighting']",Capcom,79,6.4,"""Street Fighter"" is best known for its well-polished 2D game play, and ""Street Fighter IV"" is an exemplary addition to the series. And now, based on the ""Street Fighter IV"" engine, the ""TEKKEN"" characters will be stepping into the ring to fight. Featuring two on two ""Tag Team Fighting"", and together with Battle and Training Modes, this title will push the series beyond its limits. "
PC,"Apr 23, 2013",Don't Starve,"['Action Adventure', 'Fantasy', 'General', 'Sandbox']",Klei Entertainment,79,8.3,"Assume the role of Wilson, an intrepid Gentleman Scientist who has been trapped by a demon and transported to a mysterious wilderness world. Wilson must learn to utilize his environment and its inhabitants if he ever hopes to escape and find his way back home. Enter a strange and unexplored world full of strange creatures, dangers, and surprises. Collect resources to craft items and structures that match your survival style. Play your way as you unravel the mysteries of this strange land."
PC,"Sep 23, 2015",Assault Android Cactus,"['Action', 'General', 'Scrolling', ""Shoot-'Em-Up"", 'Shooter', 'Top-Down']",Witch Beam,79,7.1,"Assault Android Cactus is a twin stick shoot 'em up with an emphasis on high pressure and stylish action. Expect screens full of enemies, buckets of bullets and high scoring combo chains! Take on the role of Cactus, an enthusiastic police android, who responds to a stranded space freighter only to discover it under siege by its... "
PC,"Oct 15, 2021",Crysis Remastered Trilogy,"['Compilation', 'Miscellaneous']",Crytek,79,7.7,"The classic first person shooter from Crytek is back with the action packed gameplay, sandbox world, and thrilling epic battles you loved the first time around. Crysis Remastered Trilogy includes each of the single player campaigns from the legendary first person shooters Crysis, Crysis 2, and Crysis 3, optimized for today's hardware. Relive the adventure in this great value all in one bundle."
PC,"May 21, 2019",Observation,"['Adventure', 'General']",Devolver Digital,79,7.4,"Observation is a sci-fi thriller uncovering what happened to Dr. Emma Fisher, and the crew of her mission, through the lens of the station’s artificial intelligence S.A.M. Players assume the role of S.A.M. by operating the station’s control systems, cameras, and tools to assist Emma in discovering what is happening to the station, the vanished crew, and S.A.M. himself."
PC,"Sep 20, 2019",Untitled Goose Game,"['General', 'Simulation']",Panic Inc.,79,6.7,"It's a lovely morning in the village and you are a horrible goose. Untitled Goose Game is a slapstick-stealth-sandbox, where you are a goose let loose on an unsuspecting village. Make your way around town, from peoples' back gardens to the high street shops to the village green, setting up pranks, stealing hats, honking a lot, and generally ruining everyone’s day."
PC,"Feb 19, 2021",Blizzard Arcade Collection,"['Compilation', 'Miscellaneous']",Activision,79,3.0,"Relive the Legacy: Experience a blast from Blizzard's past! The Blizzard® Arcade Collection brings three of our classic console games to modern platforms and new audiences. INCLUDED GAMES:"
PC,"Dec  1, 2015",Tom Clancy's Rainbow Six Siege,"['Action', 'First-Person', 'Modern', 'Shooter', 'Tactical']",Ubisoft,79,7.0,"Tom Clancy’s Rainbow Six Siege is inspired by real world counter-terrorist organizations, and inserts players in the middle of lethal close-quarters engagements. For the first time in a Tom Clancy’s Rainbow Six game, players can choose from a variety of unique Counter Terrorist Operators and engage in tangible sieges, a new style of assault in which enemies have the means to transform their environments into modern strongholds while Rainbow Six teams lead the assault to breach the enemy’s position."
PC,"Nov  5, 2013",State of Decay,"['Action Adventure', 'Horror', 'Survival']",Microsoft Game Studios,79,6.9,"The end is here. Life as you knew it has gone to hell after the mother of all zombie outbreaks. Now you and the few scattered survivors must band together to survive and rebuild in a 3rd-person action game set in a dynamic open world. You choose where to make your stand, designing and fortifying your home base, performing daring raids for food and ammunition, and rescuing other playable survivors with unique talents. The open, sandbox world develops in real-time, shaped by your actions, dynamically generating content based on your choices and the ever-increasing zombie threat."
PC,"Jun 25, 2010",LEGO Harry Potter: Years 1-4,"['Action Adventure', 'Adventure', 'Fantasy', 'General', 'Linear']",Warner Bros. Interactive Entertainment,79,7.6,"Build the adventure from Privet Drive to the Triwizard Tournament and experience the fun of the first four Harry Potter stories – Lego style. Explore Hogwarts School of Witchcraft and Wizardry, learn spells, brew potions and relive the adventures with tongue-in-cheek humor and creative customization that is unique to LEGO videogames."
PC,"Aug 13, 2018",World of Warcraft: Battle for Azeroth,"['Board / Card Game', 'Massively Multiplayer', 'Miscellaneous', 'Role-Playing']",Blizzard Entertainment,79,2.7,DECLARE YOUR ALLEGIANCE
PC,"Feb  8, 2018",Sid Meier's Civilization VI: Rise and Fall,"['4X', 'Strategy', 'Turn-Based']",2K Games,79,6.4,"Civilization VI is a game about building an empire to stand the test of time, and the Rise and Fall expansion brings new choices, strategies, and challenges for players as they guide a civilization through the ages. Can you inspire the Loyalty of people around the world, or will you lose cities to your rivals? Will you establish a Golden Age for your civilization, or be mired in a Dark Age? In Civilization VI: Rise and Fall, you truly become a leader for the ages. Successful leadership of a civilization can send it into a prosperous Golden Age, but falling behind can usher in a Dark Age. Respond well to the challenges of a Dark Age, and your civilization can rise again into renewal with a Heroic Age."
PC,"Oct 13, 2016",Shadow Warrior 2,"['Action', 'Arcade', 'First-Person', 'Shooter']",Devolver Digital,78,8.0,"Shadow Warrior 2 is the evolution of Flying Wild Hog’s offbeat first-person shooter following the further misadventures of former corporate shogun Lo Wang. Now surviving as a reclusive mercenary on the edge of a corrupted world, the formidable warrior must again wield a devastating combination of guns, blades, magic and wit to strike down the demonic legions overwhelming the world. Battle alongside allies online in four-player co-op or go it alone in spectacular procedurally-generated landscapes to complete daring missions and collect powerful new weapons, armor, and arcane relics of legend."
PC,"Nov 17, 2017",Star Wars Battlefront II,"['Action', 'First-Person', 'Shooter', 'Tactical']",Electronic Arts,65,1.8,"Star Wars Battlefront II allows players to experience the untold story of an Imperial elite special forces soldier in an all-new single player campaign. In epic multiplayer battles, players pilot a First Order TIE fighter through intense dogfights in space, and play as ground troopers or iconic heroes and villains, such as Yoda and Darth Maul, across all three Star Wars eras. Featuring new characters created by Motive in close partnership with the story group at Lucasfilm, the Star Wars Battlefront II single player campaign delivers a new story to the Star Wars universe. Taking place in the 30 years between the destruction of Death Star II and through the rise of the First Order, the single player story introduces Iden Versio, the leader of Inferno Squad, an elite special forces unit of the Galactic Empire, who are equally lethal on the ground and in space. In addition to Iden, players also encounter and play as other iconic Star Wars heroes and villains like Luke Skywalker and Kylo Ren during the campaign. [Electronic Arts]"
PC,"Feb 23, 2021",Curse of the Dead Gods,"['Action RPG', 'Role-Playing']",Focus Home Interactive,78,7.7,"You seek untold riches, eternal life, divine powers -- it leads to this accursed temple, a seemingly-infinite labyrinth of bottomless pits, deadly traps, and monsters."
PC,"Jun  3, 2008",LEGO Indiana Jones: The Original Adventures,"['Action Adventure', 'Adventure', 'General']",LucasArts,78,7.9,"LEGO Indiana Jones: The Original Adventures takes the fun and creative construction of LEGO and combines it with the wits, daring and non-stop action from the original cinematic adventures that enthralled audiences everywhere (Indiana Jones and the Raiders of the Lost Ark, Indiana Jones and the Temple of Doom and Indiana Jones and the Last Crusade). With a unique tongue-in-cheek take on the original adventures, LEGO Indiana Jones follows Dr. Jones escapades through the jungles of South America to the mountaintops of India. Fans can build, battle and brawl their way through their favorite cinematic moments, from Indy's entanglements with snakes to his dashing boulder run. Pop culture's most iconic archeologist whips through all the classic moments with the help of a host of supporting characters including Marion Ravenwood and Short Round. Players can also mix and match the body parts of more than 60 playable characters to create new heroes just as they could in the LEGO Star Wars games. [LucasArts]"
PC,"Sep 16, 2003",NASCAR Thunder 2004,"['Automobile', 'Driving', 'Racing', 'Simulation', 'Stock Car']",EA Games,78,7.5,"From 200 MPH super-speedways to hairpin turns on 11 fantasy tracks, tuning your car and finding the line is no longer enough. Now you?re running to the edge against 42 other unique NASCAR® personalities every race, drivers who remember your every move and won?t think twice about paying you back. Out-smart and out-drive them as you battle three-wide from green to checkers. Online or on your own, racing just became a contact sport. Grudges & Alliances: Emotion comes to a racing game for the first time as CPU drivers remember your every move and aren't afraid to pay you back. Pick up & Play controls help new fans navigate over 60 events including all real world NASCAR races, plus 12 winding road courses. NASCAR Thunder 2004 goes online with peer-to-peer racing on the PlayStation®2 and 16 player races on PC. The most extensive Career Mode in a NASCAR video game just got deeper and easier to navigate! The deepest NASCAR game ever created with over 70 drivers and 175 authentic cars and the first game with a full pack of 43 Cup Series cars. [Electronic Arts]"
PC,"Oct  6, 2017",Doki Doki Literature Club!,"['Adventure', 'Visual Novel']",Team Salvato,78,8.5,"Hi, Monika here!"
PC,"Dec 11, 2017",Fallout 4 VR,"['Role-Playing', 'Western-Style']",Bethesda Softworks,78,5.1,"Fallout 4, the legendary post-apocalyptic adventure from Bethesda Game Studios and winner of more than 200 'Best Of' awards, including the DICE and BAFTA Game of the Year, finally comes in its entirety to VR. Fallout 4 VR includes the complete core game with all-new combat, crafting, and building systems fully reimagined for virtual reality. The freedom of exploring the wasteland comes alive like never before. As the sole survivor of Vault 111, you enter a world destroyed by nuclear war. Every second is a fight for survival, and every choice is yours. Only you can rebuild and determine the fate of the Wasteland. Welcome home."
PC,"Oct  8, 2019",Indivisible,"['Action RPG', 'Role-Playing']",505 Games,78,6.4,"INDIVISIBLE is inspired by classics like Valkyrie Profile and Metroid, and has the unique character, world, and gameplay depth Lab Zero is known for."
PC,"May 25, 2017",Vanquish,"['Action', 'Arcade', 'Shooter', 'Third-Person']",Sega,78,8.8,"Directed by Shinji Mikami, VANQUISH is a sci-fi shooter of epic proportions with a fast, fluid and frenetic combat system, and an engaging and immersive storyline. Players take the role of Sam, a government agent kitted out with a futuristic battle suit, in a near future world where nations war over the planet's remaining energy resources. A versatile fighter with a huge arsenal of weaponry at his disposal, Sam also has an array of martial arts skills that he can use to take down his robot enemies."
PC,"May  9, 2016",Stellaris,"['General', 'Real-Time', 'Strategy']",Paradox Interactive,78,8.0,"Featuring deep strategic gameplay, an enormous selection of alien races and emergent storytelling, Stellaris has a deeply challenging system that rewards interstellar exploration as you traverse, discover, interact and learn more about the multitude of species you will encounter during your travels. Etch your name across the cosmos by uncovering remote celestial outposts,and entire civilizations. Will you expand through war or walk the path of diplomacy to achieve your goals?"
PC,"Dec  5, 2017",The Surge: A Walk in the Park,"['Action RPG', 'Role-Playing']",Focus Home Interactive,78,7.6,"Welcome to CREO World, the amusement park built for CREO employees and families! Forget your cravings for cotton candy though – CREO World was not spared from the disaster. The entire park is a death trap, where roaming rescue teams have gone insane and robotic mascots patrol freely, patiently waiting for new visitors to offer a deadly welcome."
PC,"Mar 14, 2018",Attack on Titan 2,"['Action', 'General']",Koei Tecmo Games,78,6.7,"Based on the anime series and building on the fast-paced action the series is famous for, ATTACK ON TITAN 2 is the sequel to 2016's action game and features new gameplay mechanics. Players once again don the renowned Omni-Directional Manoeuver Gear as they fight and repel the fearsome Titans that threaten humanity, to restore peace within the walls. "
PC,"Mar 11, 2015",Resident Evil: Revelations 2 - Episode 3: Judgment,"['Action Adventure', 'Survival']",Capcom,78,7.6,"Resident Evil Revelations 2 - Episode 1 required; sold separately. Xbox Live free membership required. Xbox Live Gold membership required for multiplayer features. Episode Three: Judgment Neil is caught in the Overseer's trap. Following a clue he left behind, Claire and Moira search for a way into the Overseer's tower. Meanwhile, Barry confronts a dangerous figure with a mysterious connection to Natalia's past. Lives and ulterior motives intertwine, never knowing what fate the island has in store."
PC,"Jan  1, 2009",Closure,"['2D', 'Action', 'Platformer']",Eyebrow Interactive,78,6.5,"In the mysterious world of Closure, only what you see exists. Manipulate lights to phase objects in and out of reality in this multiple-award-winning puzzle game. Play as a strange spider-like demon who explores the stories of three human characters through beautiful, eerie environments such as a decrepit factory, a murky forest, an abandoned carnival, and the strange, surreal realm that connects them together."
PC,"Jun 25, 2021",Scarlet Nexus,"['Action Adventure', 'Action RPG', 'Open-World', 'Role-Playing']",Bandai Namco Games,78,7.7,"Unleash the Power of the Mind - In a far distant future, a psionic hormone was discovered in the human brain, granting people extra-sensory powersand changing the world as we know it. Just as humanity was entering this new era, deranged mutants known as Others began to descend from the sky with a thirst for human brains. Highly resistant to conventional attack methods, extreme measures needed to be taken to battle the overwhelming threat and preserve humanity. Those with acute extra-sensory abilities, known as psionics, were our chance to fight the onslaught from above. To this day, psionics have been scouted for their talents and recruited to the Other Suppression Force (OSF), humanity's last line of defense."
PC,"Mar 31, 2022",Weird West,"['Action RPG', 'Role-Playing']",Devolver Digital,78,7.5,"Survive and unveil the mysteries of the Weird West through the intertwined destinies of its unusual heroes in an immersive sim from the co-creators of Dishonored and Prey. Discover a dark fantasy reimagining of the Wild West where lawmen and gunslingers share the frontier with fantastical creatures. Journey through the origin stories of a group of atypical heroes, written into legend by the decisions you make in an unforgiving land. Each journey is unique and tailored to the actions taken - a series of high stakes stories where everything counts and the world reacts to the choices you make. Form a posse or venture forth alone into an otherworldly confines of the Weird West and make each legend your own."
