Platform,Date,Title,Genre,Company,Metascore,Userscore,Summary
PC,"Jan 23, 2006",GT Legends,"['Automobile', 'Driving', 'GT / Street', 'Racing', 'Simulation']",Viva Media,84,7.8,"The golden age of motor sports has returned. Experience one of the world's most exciting racing series in GT Legends, including the legendary touring cars of the 60's and 70's. Collect more then 90 original FiA GTC-TC team vehicles and demonstrate your driving skill on real European racetracks. Original Tracks: Over 25 variations of real tracks like Imola, Monza, Donington and Mondello Park. 5 Difficulty Levels: Ranging from the easy beginner mode to the ultra realistic simulation mode. Career Mode: Win numerous cups and buy your dream car in this challenging mode. Pure Realism: Experience an unequalled level of realism in cooperation with FiA GTC-TC teams, incl. pit stops and car setups. Real Sounds: Sophisticated recording techniques guarantee an authentic acoustic profile for each vehicle. Incredible Graphics: Leading edge graphics technology enabling spectacular special effects and dynamic day and night cycles. Multiplayer Mode: Impress your friends with rare unlockable cars and challenge up to 15 opponents online. [Atari]"
PC,"Feb 18, 2014",Ikaruga,"['Action', 'Scrolling', ""Shoot-'Em-Up"", 'Shooter', 'Vertical']",Treasure,84,8.4,"""Ikaruga"" is a quick-paced shooter with strong strategy elements featuring a slow-motion training mode and co-op play for two. Available soon for download from Xbox LIVE Arcade, ""Ikaruga"" is the perfect combination of beautiful, manga-style storytelling and refined, ultra-challenging arcade heroics."
PC,"Feb  2, 2018",Sprint Vector,"['Arcade', 'Other', 'Racing']",Survios,84,6.8,"Welcome to Sprint Vector championship intergalactica, where the physical thrill of extreme sports meets the unhinged energy of a crazy game show. Run, jump, climb, fling, and fly at extreme velocity as you race up to eight players and battle obstacles in this frenetic VR adrenaline platformer that puts your speed and finesse to the test."
PC,"Oct 10, 2007",Puzzle Quest: Challenge of the Warlords,"['Matching', 'Miscellaneous', 'Puzzle']",GamersGate,84,7.8,"Designed specifically to entertain both casual and hardcore gamers with its deep immersion, five to fifteen minute play sessions and turn-based play style, Puzzle Quest: Challenge of the Warlords incorporates strategy, role-playing elements and a persistent storyline in a puzzle board setting. Set in the Warlords universe, the game challenges players to create, develop and customize the ultimate hero in order to save the land of Etheria from evil Lord Bane. To advance their character, players battle in turn-based, head-to-head ""match-three"" style puzzle games in one of three distinct gameplay modes: Single-player allows gamers to battle against the AI as they embark on over 150 challenging quests, Instant Action allows gamers to jump in and immediately play continuous battles to level-up characters without participating in quests, and Multiplayer allows gamers to battle live opponents. Victory will advance the player’s hero, magical arsenal, creature companions and more - ultimately rewarding gamers at nearly every turn and providing endless hours of replayability. [D3Publisher of America]"
PC,"Sep  4, 2018",Destiny 2: Forsaken,"['Action', 'Arcade', 'First-Person', 'Shooter']",Activision,84,6.1,"With 2 brand-new destinations to explore, and new weapons, armour and Supers to acquire, Forsaken takes players on an epic journey into the wild frontiers of our solar system where the lines between justice and revenge are blurred. Forsaken also features an all-new competitive and collaborative endgame activity, called Gambit. A first-of-its kind for Destiny, Gambit is a new, hybrid 4v4 mode that merges both PvE and PvP experiences into an epic battle. This entirely new way to play Destiny 2 offers something for all types of gamers to enjoy, appealing to those who thrive on the competitive challenge of PvP gameplay, while seamlessly blending the collaborative and unpredictable elements of PvE. [Bungie] "
PC,"Sep 12, 2001",Sub Command,"['Combat', 'Marine', 'Simulation', 'Submarine']",Electronic Arts,84,7.1,"Take charge of the most deadly modern-day submarines in the world as you command three distinct submarines across two unique and challenging campaigns. Utilize cutting-edge technology to navigate the world's oceans to locate, track and destroy enemy convoys. Or, park your sub off hostile shores to deliver Tomahawk missiles to inland targets. Whether diving, scouring or surfacing, you control the smartest, stealthiest, and most feared subs in the water today. [Electronic Arts]"
PC,"Aug 10, 2017",Hearthstone: Heroes of Warcraft - Knights of the Frozen Throne,"['Card Battle', 'Strategy', 'Turn-Based']",Blizzard Entertainment,84,3.3,"An icy wind howls outside the inn's walls, but the chill you feel crawling up your spine has little to do with the bitter cold. No deck is safe from the Lich King's evil influence; even the most stalwart champions of the Light have been turned into wicked Death Knights. As the agents of the undead Scourge plague the land, it falls to you to gather your cards, face these vile abominations, and turn their dark powers against them."
PC,"Apr 28, 2006",Guild Wars Factions,"['Compilation', 'General', 'Massively Multiplayer', 'Miscellaneous', 'Role-Playing']",NCSOFT,84,8.4,"The stand-alone Guild Wars Factions is the second campaign in ArenaNet's massively multiplayer online role-playing game. The Factions campaign, which can be played either connected with the regular Guild Wars or as its own separate game, includes new regions (with an entire new continent), professions, skills, missions, and monsters, along with expanded options for both Cooperative and Player-versus-Player (PvP) play, and enhanced features for guilds. New content includes a number of the skills added to Guild Wars: Factions, including some of the deadly skills of the Assassin and the arcane spells of the spiritual Ritualist. Factions will also introduce a new PvP continent, Battle Isles. Battle Isles will introduce players to new PvP experiences, new and expanded arenas, new quests and a new explorable area as well. [NCsoft]"
PC,"Jan 19, 2016",Darkest Dungeon,"['General', 'Role-Playing']",Red Hook Studios,84,7.9,"Darkest Dungeon is a gothic roguelike RPG dungeon crawler about the psychological stresses of adventuring. You will lead a band of four heroes on a perilous side-scrolling descent, dealing with a prodigious number of threats to their bodily health, and worse, a relentless assault on their mental fortitude! Five hundred feet below the earth you will not only fight unimaginable foes, but famine, disease, and the stress of the ever-encroaching dark. Darkest Dungeon focuses on the humanity and psychological vulnerability of the heroes and asks: What emotional toll does a life of adventure take?"
PC,"Sep  7, 2008",Spore,"['Breeding/Constructing', 'General', 'Strategy']",EA Games,84,5.7,"From the mind of Will Wright comes SPORE, a journey that takes you from the origin and evolution of life through the development of civilization and technology and eventually all the way into the deepest reaches of outer space. Begin your odyssey at the dawn of life as a simple microbe just trying to survive, then use the fun, intuitive Editors to evolve the creature from its microscopic origins into an intelligent, tool-using race. Guide your species as it builds (and the player designs) villages, buildings, cities, and vehicles. Along the way to becoming a global civilization you can choose whether to hunt or forage, attack or trade, be nice or play rough. All the action takes place in a huge, lush world populated with creatures evolved by other players and shared over SPORE's central servers. When it's ready, your one-time pond scum launches into space in its UFO on a grand voyage of discovery, planet forming, or destruct-ion. As you explore and play in this limitless universe of unique worlds, your personal Sporepedia tracks all the creatures you've met and places you've visited. Take complete control of your creature's fate as you guide it through the following six evolutionary phases: Tidepool phase: Fight with other creatures and consume them to adjust the form and abilities of your creature. It's survival of the fittest at the most microscopic level. Creature phase: Venture onto dry land and help your creature learn and evolve with forays away from your safe haven. Carnivore or Herbivore? Social or Independent? The choice is yours. Tribal phase: Instead of controlling an individual creature, you are now caring for an entire tribe of your genetic craftwork. Give them tools and guide their interactions as you slowly upgrade their state of existence. City phase: Bring your creatures' race into a new golden era by building up the technology, architecture, and infrastructure of their city. Civilization phase: Once your city is established, your creatures begin seeking out and interacting with other cultures. You can have them do so with an olive branch or a war cry—either way, the goal for your creatures is to unify the planet. Space phase: The time has come to move on to other worlds in your solar system. Make first-contact, colonize, or terraform, then venture further to find other solar systems scattered throughout a magnificently rendered galaxy. A 'mission' structure provides new goals and paths to follow as you begin to spread through the universe. [Electronic Arts]"
PC,"Jan 23, 2018",Total War: WARHAMMER II - Rise of the Tomb Kings,"['Real-Time', 'Strategy', 'Tactics']",Sega,84,7.1,"Across the arid deserts of Nehekhara, vast legions of skeletal warriors rise from beneath the baking sands to slaughter those who trespass into their domain. It is a lifeless realm of endless dunes, stained red from the blood of savages and barbarians. This is the Land of the Dead, where mummified kings are cursed to rule in perpetual unlife. But it was not always thus."
PC,"May 29, 2014",Europa Universalis IV: Wealth of Nations,"['General', 'Historic', 'Real-Time', 'Strategy']",Paradox Interactive,84,8.5,"The expansion allows you to create trade conflicts in secret, steal from your competitors with the use of privateers, use peace treaties to gain trade power and create a new trade capital to strengthen your grasp over trade. The age of exploration is brought to life in this epic game of trade, diplomacy, warfare and exploration by Paradox Development Studio, the Masters of Strategy. Europa Universalis IV gives you control of a nation to rule an empire that lasts through the ages. "
PC,"Apr 30, 2020",Streets of Rage 4,"['2D', 'Action', ""Beat-'Em-Up""]",DotEmu,84,7.8,"Publisher Dotemu (Wonder Boy, Windjammers 1/2) and developers Lizardcube (Wonder Boy) and Guard Crush Games today revealed Streets of Rage 4, an all-new continuation of SEGA's iconic arcade brawler series known for its radical fights, jammin' '90s beats and dashing sparring gloves and bandanas. "
PC,"Nov 19, 2013",Assassin's Creed IV: Black Flag,"['Action Adventure', 'Historic', 'Open-World']",Ubisoft,84,8.0,"The year is 1715. Pirates rule the waters of the Caribbean and have established a lawless Republic. Among these outlaws is a lethal young captain named Edward Kenway. His notorious exploits earn the respect of legends like Blackbeard, but draw him into an ancient war that may destroy everything the pirates have built for themselves."
PC,"Jan 12, 2003",SimCity 4,"['City Building', 'Government', 'Management', 'Modern', 'Strategy']",EA Games,84,8.7,"PLAY GOD - Sculpt mountains, gouge valleys, seed forests, and bring forth animals to create a world imagined only by you. Summon volcanoes, release tornadoes, and call down meteors and ligthening. PLAY MAYOR - Connect a massive region of SimCities, each sharing and competing for resources. Deploy emergency vehicles and join in the action as they battle blazes, mobs, and more. PLAY WITH YOUR SIMS - Place your Sims in your city to get the inside scoop on what life's really like around town. Feel the rhythm of the city: mellow cruising and commuter hell, noontime crowds and nighttime calm. [Electronic Arts]"
PC,"Sep 30, 2003",Age of Mythology: The Titans,"['Fantasy', 'General', 'Real-Time', 'Strategy']",Microsoft Game Studios,84,8.8,"Age of Mythology: The Titans Expansion adds a fourth mythology, the Atlanteans, to the existing Greek, Egyptian and Norse mythologies. A new single-player campaign will add yet another chapter to the franchise's expansive folklore along with the addition of new scenarios. Atlantean players will be able to call upon the might of the Titan gods (such as Atlas and Cronus) multiple times throughout the game, and may also upgrade human units to heroes. The expansion pack will introduce 12 new god powers, 15 new human units and 10 formidable myth units to the game. [Microsoft]"
PC,"Sep 10, 2021",Tales of Arise,"['Japanese-Style', 'Role-Playing']",Bandai Namco Games,84,8.4,Challenge the Fate That Binds You
PC,"Sep 14, 2012",Black Mesa,"['Action', 'Arcade', 'First-Person', 'Sci-Fi', 'Shooter']",Black Mesa Modification Team,84,8.9,"Black Mesa is a re-envisioning of Valve Software's seminal game Half-Life. You will re-visit the inaugural role of Gordon Freeman and his memorable journey through the Black Mesa Research Facility. Expect detailed environments to explore, a huge cast of characters and experimental weaponry. All-new music, voice acting, choreography and added dialogue give way to a more expansive and immersive experience than ever before. [Valve]"
PC,"Feb 22, 2006",TOCA Race Driver 3,"['Automobile', 'Driving', 'GT / Street', 'General', 'Racing', 'Simulation']",Codemasters,84,7.7,"(Also known as ""ToCA Race Driver 2006"") TOCA Race Driver 3 takes the variety of motorsport experiences available in ""Race Driver 2"" and expanding on it even further, so no matter what your taste in racing, you'll find something to suit you. Featuring the British GT championship, series stalwarts the DTM and Aussie V8 Supercars, Sprint Cars, Rallying, and open wheel racing all the way from karts to the BMW Williams Grand Prix Cars, and much more TOCA Race Driver 2006 has something for everyone. Race on tracks from all over the world, take the story-driven ""world tour"" mode if you want to get straight to where the action is, or for the people wanting the nuts and bolts, take the ""Pro Career"" mode and work you way up the ladder in different disciplines of motorsport, aiming for the pinnacle of your chosen field. [Codemasters]"
PC,"Sep 14, 2012",FTL: Faster Than Light,"['Combat', 'Sci-Fi', 'Simulation', 'Small Spaceship', 'Space']",Subset Games,84,8.4,"You manage the Kestrel and its crew as you explore the galaxy. Strategic, real-time combat involves managing power between essential systems and choosing which enemy systems to target. Meanwhile, you control your crew to keep the ship functioning and fight off intruders. The combat is difficult but, being a ""roguelike-like"" game, frequent permadeath is at the core of the experience."
PC,"Sep 21, 2015",SOMA,"['Action Adventure', 'Horror', 'Survival']",Frictional Games,84,8.4,"Strange occurrences are disrupting the routines of the PATHOS-2 research facility. The radio is silent. Behavioral anomalies of the machines are increasingly dangerous, if not... malevolent. The facility is devolving into chaos. No weapons, and the only escape is practically unthinkable. From Frictional Games, creators of the Amnesia and Penumbra series, SOMA is an aberrant tale of scientific inquiry and survival; an entropic exploration of synapse and circuit that wades through the delusions of human consciousness."
PC,"Sep 29, 2006",DEFCON: Everybody Dies,"['General', 'Real-Time', 'Sci-Fi', 'Strategy']","Encore Software, Inc.",84,8.4,"Inspired by the 1983 cult classic film, ""Wargames,"" DEFCON superbly evokes the tension, paranoia and suspicion of the Cold War era, playing on the fascinating aspects of psychological gameplay that occur during strategic nuclear warfare. You play a General hidden deep within an underground bunker. Your mission is to successfully exterminate your enemy's civilian population whilst saving your own. Points are awarded or lost depending on both the efficacy and thoroughness of your nuclear vendetta and the number of your own civilian deaths. In order to win you must wipe out the enemy population and simultaneously disable the enemy's ability to retaliate against you. This is an extremely difficult task since launching an attack on the enemy exposes the positions of your own Ground Silos, Subs and Bombers the moment they launch nuclear weapons, making you extremely vulnerable and exposed to a crushing counter-attack. Desperate attempts must be made to form fast, tactical alliances, alliances that may at any moment break-down to become the treacherous and most deadly of betrayals. Everyone looks to each other in a state of nervous suspense and paranoid accusation. In all-out nuclear Armageddon, everybody dies, everybody loses, you just have to make sure you lose the least! [Valve]"
PC,"Mar 15, 2019",Tom Clancy's The Division 2,"['Action', 'First-Person', 'Shooter', 'Tactical', 'Third-Person']",Ubisoft,84,4.6,"Set in Washington D.C., the game takes place 7 months after a deadly virus was released in New York City and the nation has become a shell of its former self. While the virus has been contained, its effects are most evident in the devastated streets of the nation's capital where survivors cling to hope and struggle to rebuild. Enter The Division, a unit of civilian sleeper agents who now must work to stop enemy factions from completely taking over the city – and ultimately, the nation. As a universally-regarded seat of power, if D.C. falls, the nation falls. With civilians helpless and fearing for their lives, players will be the last line of defense in preventing the total collapse of society. [Ubisoft]"
PC,"Aug 26, 2003",Tron 2.0,"['Action', 'Action Adventure', 'Arcade', 'First-Person', 'General', 'Sci-Fi', 'Shooter']",Buena Vista Interactive,84,8.3,"TRON 2.0 is the present-day sequel to the 1982 cult film classic that wasa landmark of computerized graphical ingenuity. TRON 2.0, is a story-driven, first-person action game that propels the player into an alternate universe inside a computer. As Jet Bradley (son of the original films hero Alan Bradley) you will combat digital opponents using guns, rods, grenades, missiles, and the iconic TRON disc. Combining the best of the genre with a truly innovative look and breakthrough game play, TRON 2.0 delivers an adventure unlike any other. It will take PC gaming to a new level with intense action, intense and deadly battles, and high-speed light cycle races. [Disney]"
PC,"Mar 17, 2017",NieR: Automata,"['Action RPG', 'Role-Playing']",Square Enix,84,8.6,"The distant future"
PC,"Jan 26, 2015",Grim Fandango Remastered,"['3D', 'Adventure', 'Fantasy', 'Third-Person']",Double Fine Productions,84,8.1,"Something is rotten in the land of the Dead, and you are being played for a sucker. Please meet Manny Calavera, travel agent at the Department of Death. He sells luxury packages to souls on their 4-year trip to eternal rest. But there is trouble in paradise. Help Manny untangle himself from a conspiracy that threatens his very salvation. [Double Fine]"
PC,"Aug 18, 2020",Spiritfarer,"['Action Adventure', 'Sandbox']",Thunder Lotus Games,84,8.1,"A cozy management game about dying.  What will you leave behind?"
PC,"Mar  2, 2006",The Lord of the Rings: The Battle for Middle-Earth II,"['Fantasy', 'General', 'Real-Time', 'Strategy']",EA Games,84,7.8,"Given a new agreement with The Saul Zaentz Company d/b/a Tolkien Enterprises that grants EA the rights to develop games based on the books, in addition to a separate agreement that allows for games based on the New Line Cinema films The Lord of the Rings, The Battle for Middle-earth II will introduce players to depths of the fiction never before explored by EA. With all new content from J.R.R. Tolkien's original fiction, delve deeper than ever before and engage in new battles that go beyond the award-winning movie trilogy. Wage war in the North and assume command of the most storied civilizations in all of Middle-earth history -- the Elven and Dwarven armies -- or fight on the side of Evil with heroes and creatures that have never been seen in The Lord of the Rings films. Defend or overtake never before seen lands such as Dol Guldur, The Misty Mountains, and Mirkwood as you unleash powerful new weapons and abilities - summon dragons, cause volcanoes to erupt, or bring down a cataclysmic lightning strike. But beware, with greater power comes greater adversity. Your enemies, commanded by a powerful new AI system, possess a greater tactical edge and more powerful spells. Will your armies have the fortitude to persevere? [Electronic Arts]"
PC,"Mar 14, 2004",Battlefield Vietnam,"['Action', 'Arcade', 'First-Person', 'Historic', 'Shooter']",EA Games,84,7.6,"The Battlefield franchise enters a new era equipped with more firepower, modernized weaponry and vehicles, and a deeper infantry experience from the jungles to the beaches of Vietnam. From villages on the Ho Chi Minh Trail to the city streets of Hue, wage modern warfare as the United States or North Vietnamese Army (NVA). Select from a variety of characters within the different soldier classes as you command powerful new vehicles including the UH-1 Huey helicopter, the M551 Sheridan tank, and the F-4 Phantom fighter jet on the U.S. side and the Russian-made T-54 tank, the MIG-21, and Mi-8 multipurpose helicopter on the NVA side. Go to war in new dramatic battle scenarios including leading a squadron of Huey helicopters in an all-out attack on an enemy compound, executing an ambush of enemy soldiers from dense foliage, captaining a PT boat through a dangerous jungle river passage, and more. Grab your M-16, ready the Napalm and prepare to enter some of the fiercest battles of the Vietnam War. [Electronic Arts]"
PC,"Sep 21, 2017",Project CARS 2,"['Automobile', 'Racing', 'Simulation']",Bandai Namco Games,84,7.2,"Project CARS 2 is the next evolution in the award-winning racing series, featuring the most iconic cars racing under the most thrilling conditions to deliver the Ultimate Driver Journey."
PC,"Oct 27, 2017",Assassin's Creed Origins,"['Action Adventure', 'Edutainment', 'Miscellaneous', 'Open-World']",Ubisoft,84,6.9,"Set in mysterious Ancient Egypt, Assassin’s Creed Origins is a new beginning. Experience a new way to fight while exploring the Great Pyramids and hidden tombs across the country of Ancient Egypt, and encounter many memorable storylines along your journey. And discover the origin story of the Assassin's Brotherhood. [Ubisoft]"
PC,"Oct 16, 2014",Ultimate General: Gettysburg,"['General', 'Military', 'Real-Time', 'Strategy']",Game-Labs,84,7.8,"Ultimate General: Gettysburg is a Tactical Battle Simulator that allows you to lead thousands of soldiers in the famous Battle of Gettysburg as commander of either the Union or Confederate army. The game features the most accurately created map, detailed order of battle, complex morale, and innovative control mechanics. "
PC,"Dec  8, 2009",Borderlands: The Zombie Island of Dr. Ned,"['Action', 'Arcade', 'First-Person', 'Sci-Fi', 'Shooter']",2K Games,84,7.3,"(Downloadable Content)  The Zombie Island of Dr. Ned is an add-on pack for Borderlands with new enemy types, new missions, and new ... surprises. The Jakobs Corporation would like to invite you to experience the splendor of a corporate owned small town known as Jakobs Cove.  Any rumors you may have heard about the ""undead"" walking our streets are completely preposterous and we officially deny them all.  If those rumors turn out to be true simply purchase a firearm from the conveniently located Jakobs Brand Vending Machines and aim for the head.  Also, would you mind saving our employees?  (Non-union only please)."
PC,"Mar 30, 2021",Kingdom Hearts III + Re Mind,"['Action RPG', 'Role-Playing']",Square Enix,84,6.8,The other tale that unfolded during the climax of KINGDOM HEARTS III.
PC,"Sep 28, 2020",Genshin Impact,"['Action RPG', 'Role-Playing']",miHoYo,84,4.1,"Welcome to the beautiful fantasy world of Teyvat. Step into a huge open-world of adventure and mystery, where heroic quests await. As a traveller from another world, you must find your lost sibling and unravel Teyvat's many secrets. Joined by Paimon, a kind-hearted sprite guide, your mission takes you through beautiful forests, bustling towns, and treacherous dungeons. And while your journey may put you into the path of merciless foes and fiendish puzzles you can count on numerous playable allies to join your custom party of four, harnessing the power of the elements to overcome all obstacles. "
PC,"Apr 18, 2006",Final Fantasy XI: Treasures of Aht Urhgan,"['Fantasy', 'Massively Multiplayer', 'Massively Multiplayer Online', 'Role-Playing']",Square Enix,83,7.0,"Final Fantasy XI is the first cross-platform, cross-continent massively multi-player online role-playing game in the world. With the release of this third expansion, players will uncover the legends surrounding the Aht Urghan Empire. With new jobs, including the highly requested Blue Mage and Corsair, additional areas to explore, and powerful new monsters, Treasures of Aht Urhgan expands the world of Vana'diel making it an even livelier place to visit. [Square Enix]"
