Platform,Date,Title,Genre,Company,Metascore,Userscore,Summary
PC,"Mar 30, 2021",Disco Elysium: The Final Cut,"['General', 'Role-Playing', 'Western-Style']",ZA/UM,97,8.2,"Disco Elysium - The Final Cut is the definitive edition of the smash-hit RPG. Pursue your political dreams in new quests, meet and question more of the city's locals, and explore a whole extra area. Full voice-acting, controller support, and expanded language options also included. Get even more out of this award-winning open world. You're a detective with a unique skill system at your disposal and a whole city block to carve your path across. Interrogate unforgettable characters, crack murders, or take bribes. Become a hero or an absolute disaster of a human being."
PC,"Nov 16, 2004",Half-Life 2,"['Action', 'Arcade', 'First-Person', 'Sci-Fi', 'Shooter']",VU Games,96,9.2,"[Metacritic's 2004 PC Game of the Year]  By taking the suspense, challenge and visceral charge of the original, and adding startling new realism and responsiveness, Half-Life 2 opens the door to a world where the player's presence affects everything around him, from the physical environment to the behaviors -- even the emotions -- of both friends and enemies. The player again picks up the crowbar of research scientist Gordon Freeman, who finds himself on an alien-infested Earth being picked to the bone, its resources depleted, its populace dwindling. Freeman is thrust into the unenviable role of rescuing the world from the wrong he unleashed back at Black Mesa. And a lot of people -- people he cares about -- are counting on him. [Vivendi Universal]"
PC,"Apr 13, 2015",Grand Theft Auto V,"['Action Adventure', 'Modern', 'Open-World']",Rockstar Games,96,7.8,"Los Santos: a sprawling sun-soaked metropolis full of self-help gurus, starlets and fading celebrities, once the envy of the Western world, now struggling to stay alive in a time of economic uncertainty and cheap reality TV. Amidst the turmoil, three very unique criminals plot their own chances of survival and success: Franklin, a street hustler looking for tangible opportunities and serious money; Michael, a professional ex-con whose retirement is less rosy than he figured it would be; and Trevor, a violent dude driven by the opportunity for a cheap high and his next big score. With options at a premium, the crew risks it all in a myriad of daring and dangerous heists that could set them up for life."
PC,"Oct 10, 2007",The Orange Box,"['Action', 'Compilation', 'First-Person', 'Miscellaneous', 'Sci-Fi', 'Shooter']",EA Games,96,9.1,"Games included in The Orange Box compilation: The original Half-Life 2 - The player again picks up the crowbar of research scientist Gordon Freeman, who finds himself on an alien-infested Earth being picked to the bone, its resources depleted, its populace dwindling. Freeman is thrust into the unenviable role of rescuing the world from the wrong he unleashed back at Black Mesa. And a lot of people - people he cares about - are counting on him. Half-Life 2: Episode One - The player reprises his role of Dr. Freeman, who must immediately face the repercussions of his actions in City 17 and the Citadel. Freeman reconnects with Alyx Vance and her robot, Dog, as they continue their support of the resistance's battle against the Combine forces.  Half-Life 2: Episode Two -- the second installment in Valve's episodic trilogy advances the award-winning story, leading the player to new locations outside of City 17. Portal - a pioneering type of single player action game that rewrites the rules for how players approach and manipulate their environment – much like how Half-Life 2's Gravity Gun reinvented the way gamers interact with objects in the game. Team Fortress 2 - an all-new version of the legendary title that spawned team based multiplayer action games. The game's daring new art style features the most advanced graphics of any Source-based game released to date. [Valve Software]"
PC,"Nov 19, 1998",Half-Life,"['Action', 'Arcade', 'First-Person', 'Sci-Fi', 'Shooter']",Sierra Entertainment,96,9.1,"Half-Life combines great storytelling in the tradition of Stephen King with intense action and advanced technology to create a frighteningly realistic world where players need to think smart to survive. Half-Life has won more than 50 Game of the Year awards from publications around the world, and was named 'Best PC Game Ever' in PC Gamer's November 1999 issue. [Sierra]"
PC,"Aug 21, 2007",BioShock,"['Action', 'Arcade', 'First-Person', 'Sci-Fi', 'Shooter']",2K Games,96,8.6,"Going beyond ""run and gun corridors,"" ""monster-closet AIs"" and static worlds, BioShock creates a living, unique and unpredictable FPS experience. After your plane crashes into icy uncharted waters, you discover a rusted bathysphere and descend into Rapture, a city hidden beneath the sea. Constructed as an idealistic society for a hand picked group of scientists, artists and industrialists, the idealism is no more. Now the city is littered with corpses, wildly powerful guardians roam the corridors as little girls loot the dead, and genetically mutated citizens ambush you at every turn. Take control of your world by hacking mechanical devices, commandeering security turrets and crafting unique items critical to your very survival. Upgrade your weapons with ionic gels, explosives and toxins to customize them to the enemy and environment. Genetically modify your body through dozens of Plasmid Stations scattered throughout the city, empowering you with fantastic and often grotesque abilities. Explore a living world powered by Ecological A.I., where the inhabitants have interesting and consequential relationships with one another that impact your gameplay experience. Experience truly next generation graphics that vividly illustrate the forlorn art deco city, highlighted by the most detailed and realistic water effects ever developed in a video game. Make meaningful choices and mature decisions, ultimately culminating in the grand question: do you exploit the innocent survivors of Rapture...or save them? [2K Games]"
PC,"Sep 24, 2000",Baldur's Gate II: Shadows of Amn,"['PC-style RPG', 'Role-Playing', 'Western-Style']",Interplay,95,9.1,"An epic continuation of the story that began in ""Baldur's Gate,"" this RPG is set along the southern portion of the Sword Coast, a detailed and rich area of the Forgotten Realms called Amn. It features 300 spells and 130-plus monster types compared to only 130 spells and 60 monster types in Baldur's Gate. [Interplay]"
PC,"Feb 25, 2022",Elden Ring,"['Action RPG', 'Role-Playing']",Bandai Namco Games,95,6.8,"A New World Created By Hidetaka Miyazaki And George R. R. Martin. ELDEN RING, developed by FromSoftware, Inc. and BANDAI NAMCO Entertainment Inc., is a fantasy action-RPG adventure set within a world created by Hidetaka Miyazaki creator of the influential DARK SOULS video game series; and George R.R. Martin author of The New York Times best-selling fantasy series, A Song of Ice and Fire. Danger and discovery lurk around every corner in FromSoftware's largest game to-date.  Hidetaka Miyazaki, President and Game Director of FromSoftware Inc. Known for directing critically-acclaimed games in beloved franchises including Armored Core, Dark Souls, and Sekiro: Shadows Die Twice.  George R.R. Martin is the #1 New York Times bestselling author of many novels, including the acclaimed series A Song of Ice and Fire - A Game of Thrones, A Clash of Kings, A Storm of Swords, A Feast For Crows, and A Dance with Dragons. As a writer-producer, he has worked on The Twilight Zone, Beauty and the Beast, and various feature films and pilots that were never made."
PC,"Nov 10, 2011",The Elder Scrolls V: Skyrim,"['First-Person', 'Role-Playing', 'Western-Style']",Bethesda Softworks,94,8.4,"The next chapter in the Elder Scrolls saga arrives from the Bethesda Game Studios. Skyrim reimagines the open-world fantasy epic, bringing to life a complete virtual world open for you to explore any way you choose. Play any type of character you can imagine, and do whatever you want; the legendary freedom of choice, storytelling, and adventure of The Elder Scrolls is realized like never before. Skyrim's new game engine brings to life a complete virtual world with rolling clouds, rugged mountains, bustling cities, lush fields, and ancient dungeons. Choose from hundreds of weapons, spells, and abilities. The new character system allows you to play any way you want and define yourself through your actions. Battle ancient dragons like you've never seen. As Dragonborn, learn their secrets and harness their power for yourself."
PC,"Jan 26, 2010",Mass Effect 2,"['Action RPG', 'Role-Playing']",Electronic Arts,94,8.9,"The Mass Effect trilogy is a science fiction adventure set in a vast universe filled with dangerous alien life forms and mysterious uncharted planets. In this dark second chapter, Saren’s evil army of Geth soldiers has just been defeated, and humans, who are still struggling to make their mark on the galactic stage, are now faced with an even greater peril. [BioWare]"
PC,"May 12, 2003",Grand Theft Auto: Vice City,"['Action Adventure', 'Modern', 'Open-World']",Rockstar Games,94,8.8,"[Metacritic's 2003 PC Game of the Year] The PC version has enhanced features including improved graphics and sound, additional PC controls, as well as several options for players to customize the game. ""Welcome to Vice City. Welcome to the 1980s."" Having just made it back onto the streets of Liberty City after a long stretch in maximum security, Tommy Vercetti is sent to Vice City by his old boss, Sonny Forelli. They were understandably nervous about his re-appearance in Liberty City, so a trip down south seemed like a good idea. But all does not go smoothly upon his arrival in the glamorous, hedonistic metropolis of Vice City. He's set up and is left with no money and no merchandise. Sonny wants his money back, but the biker gangs, Cuban gangsters, and corrupt politicians stand in his way. Most of Vice City seems to want Tommy dead. His only answer is to fight back and take over the city himself. Vice City offers vehicular pleasures to suit every taste. For the speed enthusiast, there's high-performance cars and motorbikes. For the sportsman, a powerboat or a golf buggy lets you enjoy the great outdoors. For those that need that sense of freedom and escape, why not charter a helicopter and see the beauty of Vice City from the air? [Rockstar]"
PC,"Jun 22, 1996",Quake,"['Action', 'Arcade', 'First-Person', 'Sci-Fi', 'Shooter']",id Software,94,8.8,"Rage through 32 single player levels and 6 deathmatch levels of sheer terror and fully immersive sound and lighting. Arm yourself against the cannibalistic Ogre, fiendish Vore and indestructible Schambler using letal nails, fierce Thunderbolts and abominable Rocket and Grenade Launchers. [id Software]"
PC,"Mar 25, 2013",BioShock Infinite,"['Action', 'Arcade', 'First-Person', 'Sci-Fi', 'Shooter']",2K Games,94,8.6,"Initially conceived as a floating symbol of American ideals at a time when the United States was emerging as a world power, Columbia is sent to distant shores with great fanfare by a captivated public.  What begins as a fresh new endeavor of hope turns drastically wrong as the city soon disappears into the clouds to whereabouts unknown. The player takes on the role of former Pinkerton agent Booker DeWitt, sent to the lost city to rescue Elizabeth, a young lady imprisoned there since her childhood. He develops a relationship with Elizabeth, enhancing his abilities with hers so the pair may escape from a city that is literally falling from the sky. DeWitt has to learn to fight foes in high-speed Sky-Line battles, engage in combat both indoors and amongst the clouds, and harness the power of a myriad of new weapons and abilities."
PC,"Mar 20, 2006",The Elder Scrolls IV: Oblivion,"['First-Person', 'Role-Playing', 'Western-Style']",2K Games,94,8.2,"Oblivion is a single-player game that takes place in Tamriel's capital province, Cyrodiil. You are given the task of finding the hidden heir to a throne that sits empty, the previous emperor having been killed by an unknown assassin. With no true Emperor, the gates to Oblivion (the equivalent of hell in the world of Tamriel) open, and demons begin to invade Cyrodiil and attack its people and towns. It's up to you to find the lost heir to the throne and unravel the sinister plot that threatens to destroy all of Tamriel. In keeping with the Elder Scrolls tradition, players have the option to experience the main quest at their own pace, and there are plenty of opportunities to explore the vast world and make your own way. Numerous factions can be joined, such as the thieves or mages guilds, and each contains its own complete storyline and the chance to rise to the head of the faction and reap further rewards. Oblivion features a groundbreaking new AI system, called Radiant AI, which gives non-player characters (NPCs) the ability to make their own choices based on the world around them. They decide where to eat or who to talk to and what they say. They sleep, go to church, and even steal items, all based on their individual characteristics. Full facial animations and lip-synching, combined with full speech for all dialog, allows NPCs to come to life like never before. [Bethesda]"
PC,"Oct 14, 1998",Grim Fandango,"['3D', 'Adventure', 'Fantasy', 'General', 'Third-Person']",LucasArts,94,9.1,"Something's rotten in the Land of Dead and you're being played for a sucker.  Meet Manny Calavera, travel agent at the Department of Death. He sells luxury packages to souls on their four-year journey to eternal rest. But there's trouble in paradise.  Help Manny untangle himself from a conspiracy that threatens his very salvation. [LucasArts]"
PC,"Oct 27, 2015",Divinity: Original Sin Enhanced Edition,"['Action RPG', 'Role-Playing', 'Western-Style']",Larian Studios Games,94,8.3,"Divinity Original Sin: Enhanced Edition is a much lauded Role-Playing-Game that blends deep customization and humor with dynamic turn based combat. Either in online co-op, split-screen co-op on your TV, or even alone, take advantage of a classless RPG system to create your heroes and conquer the evils of Rivellon!"
PC,"Oct 25, 2005",Sid Meier's Civilization IV,"['4X', 'Historic', 'Strategy', 'Turn-Based']",2K Games,94,8.2,"Faster-Paced Fun - Gameplay has been streamlined for a tighter, faster, and more compelling experience.Greater Accessibility and Ease of Play - An easy-to-use interface will be immediately familiar to RTS and action game players, and newcomers to the series will be able to jump in and play. Tech Tree - Flexible Tech tree allows players more strategic choices for developing their civilizations along unique paths. More Civs, Units, and Improvements to enhance and grow your empire. Multiplayer -LAN, Internet, PBEM, and Persistent Turn-Based Server (PTBS) offer players all-new strategies and ways to play when competing or cooperating with live opponents. Team Play - Whether playing multiplayer or single player, team play offers a new way of setting locked alliances that result in shared wonder effects, visibility, unit trading, and shared territory that delivers a plethora of new strategic and tactical options. Civ IV comes to life! - Beautiful 3D world with dozens of fully animated units (including culturally unique units), and totally customizable armies. Cities and wonders will appear on the map. Wonder movies are back! [2K Games]"
PC,"May 18, 2015",The Witcher 3: Wild Hunt,"['Action RPG', 'Role-Playing']",Warner Bros. Interactive Entertainment,93,9.0,"With the Empire attacking the Kingdoms of the North and the Wild Hunt, a cavalcade of ghastly riders,  breathing down your neck, the only way to survive is to fight back. As Geralt of Rivia, a master swordsman and monster hunter, leave none of your enemies standing. Explore a gigantic open world, slay beasts and decide the fates of whole communities with your actions, all in a genuine next generation format."
PC,"Sep 13, 2006",Company of Heroes,"['General', 'Historic', 'Real-Time', 'Strategy']",THQ,93,8.7,"A real-time strategy game set in World War II, Company of Heroes brings to life, in full cinematic detail, the greatest war mankind has ever known. Company of Heroes is built on Relic's next-generation Essence Engine and also utilizes the Havok Physics engine, delivering cinematic visual detail in a world completely driven by realistic physics. Gamers will experience the journey of the brave men of Able Company in a deep single-player campaign that begins with the invasion of Normandy through their fight across Europe, all set against the most dynamic battlefield ever seen in a game. Company of Heroes' completely destructable environment means no two battles ever play out in the same way. Advanced squad AI delivers startling new realism and responsiveness, bringing soldiers to life as they interact with the environment and execute advanced squad tactics to eliminate the opposition forces. [THQ]"
PC,"Mar 23, 2020",Half-Life: Alyx,"['Action', 'Arcade', 'First-Person', 'Shooter']",Valve Software,93,9.2,"Half-Life: Alyx is Valve's VR return to the Half-Life series. It's the story of an impossible fight against a vicious alien race known as the Combine, set between the events of Half-Life and Half-Life 2. Playing as Alyx Vance, you are humanity's only chance for survival. The Combine's control of the planet since the Black Mesa incident has only strengthened as they corral the remaining population in cities. Among them are some of Earth's greatest scientists: you and your father, Dr. Eli Vance. As founders of a fledgling resistance, you've continued your clandestine scientific activityperforming critical research, and building invaluable tools for the few humans brave enough to defy the Combine. Every day, you learn more about your enemy, and every day you work toward finding a weakness."
PC,"Mar 16, 2004",Unreal Tournament 2004,"['Action', 'Arcade', 'First-Person', 'Sci-Fi', 'Shooter']",Atari,93,8.8,"Reload, rev up and ride out. The new Tournament is faster, higher and meaner. Land and air based vehicles take combat to a new level; while an arsenal of new weaponry, daunting arenas and battlefields and the challenge of the Assault and Onslaught modes make the gladiator blood sport of the future a brand new experience. Buckle up; it?s gonna be one hell of a ride!  [Atari]"
PC,"Jul 27, 2010",Starcraft II: Wings of Liberty,"['Command', 'Real-Time', 'Sci-Fi', 'Strategy']",Blizzard Entertainment,93,8.3,"StarCraft II continues the epic saga of the Protoss, Terran, and Zerg. These three distinct and powerful races clash once again in the fast-paced real-time strategy sequel to the legendary original, StarCraft. Legions of veteran, upgraded, and brand-new unit types do battle across the galaxy, as each faction struggles for survival. Featuring a unique single-player campaign that picks up where StarCraft: Brood War left off, StarCraft II presents a cast of new heroes and familiar faces in an edgy sci-fi story filled with adventure and intrigue. In addition, Blizzard again offers unparalleled online play through Battle.net, the company's world-renowned gaming service, with several enhancements and new features to make StarCraft II the ultimate competitive real-time strategy game. Features fast-paced, hard-hitting, tightly balanced competitive real-time strategy gameplay that recaptures and improves on the magic of the original game. New units and gameplay mechanics further distinguish each race. Vibrant new 3D-graphics engine with support for dazzling visual effects and massive unit and army sizes. Full map-making and scripting tools to give players incredible freedom in customizing and personalizing their gameplay experience. [Blizzard]"
PC,"Nov  5, 2019",Red Dead Redemption 2,"['Action Adventure', 'Open-World']",Rockstar Games,93,6.4,"America, 1899. The end of the wild west era has begun as lawmen hunt down the last remaining outlaw gangs. Those who will not surrender or succumb are killed."
PC,"Aug 31, 1999",Homeworld,"['Command', 'General', 'Real-Time', 'Sci-Fi', 'Strategy']",Sierra Entertainment,93,8.8,"Deported to a harsh desert world, exiles have struggled for three thousand years to regain the stars. Now it's up to you to guide them home through a brutal empire bent on annihilation. Homeworld boasts amazing ship graphics and gorgeous deep-space vistas, a unique command and navigation interface and white-knuckle real-time strategy. [Sierra]"
PC,"May 20, 2002",Grand Theft Auto III,"['Action Adventure', 'Modern', 'Open-World']",Rockstar Games,93,8.2,"The PC version features enhanced 3D audio. Environmentally scaled and referenced from the player's perspective. Create your own customizable Liberty City radio station, using the built-in mp3 player. State-of-the art visuals utilizing the latest PC hardware render the city more beautifully than ever in 32 bit color. The skinnable player character enables fans to create and upload their own skin textures and to use a scanned-in photo to play as themselves. [Rockstar]"
PC,"Jan 14, 2022",God of War,"['Action Adventure', 'Linear']",PlayStation Studios,93,8.6,"The God of War has changed... and this is not the Kratos you know. A difficult and unfamiliar road awaits as you explore a stunning retelling of a classic story. Join Kratos as he adventures through a deep and reflective journey of growth, violence and the desire to become a better man for the sake of his son. In a world of monsters, dragons and gods, the weight of responsibility rests heavy on your shoulders -- and when your life is filled with blood and chaos, how can you prevent the mistakes of the past in order to protect your future?"
PC,"Nov 18, 2003",Star Wars: Knights of the Old Republic,"['General', 'Role-Playing', 'Third-Person', 'Western-Style']",LucasArts,93,9.0,"Engage in this saga set in the Golden Age of the Republic - over 4,000 years before the first Star Wars film, when both Jedi and Sith number in the thousands. With the Galaxy reeling from a recent conflict with the Dark Lords, the ongoing battle between the Jedi and the Sith rages on. Your actions determine the outcome of this colossal galactic war - and your destiny as a Jedi. [LucasArts]"
PC,"Nov 23, 2004",World of Warcraft,"['Board / Card Game', 'Fantasy', 'Massively Multiplayer', 'Massively Multiplayer Online', 'Miscellaneous', 'Role-Playing']",Blizzard Entertainment,93,7.4,"Four years have passed since the aftermath of Warcraft III: Reign of Chaos, and a great tension now smolders throughout the ravaged world of Azeroth. As the battle-worn races begin to rebuild their shattered kingdoms, new threats, both ancient and ominous, arise to plague the world once again. World of Warcraft is an online role-playing experience set in the award-winning Warcraft universe. Players assume the roles of Warcraft heroes as they explore, adventure, and quest across a vast world. Being ""Massively Multiplayer,"" World of Warcraft allows thousands of players to interact within the same world. Whether adventuring together or fighting against each other in epic battles, players will form friendships, forge alliances, and compete with enemies for power and glory. A dedicated live team will create a constant stream of new adventures to undertake, lands to explore, and monsters to vanquish. This content ensures that the game will never be the same from month to month, and will continue to offer new challenges and adventures for years to come. [Blizzard Entertainment]"
PC,"Jun  7, 2005",Grand Theft Auto: San Andreas,"['Action Adventure', 'Modern', 'Open-World']",Rockstar Games,93,8.9,"Five years ago Carl Johnson escaped from the pressures of life in Los Santos, San Andreas... a city tearing itself apart with gang trouble, drugs and corruption. Where filmstars and millionaires do their best to avoid the dealers and gangbangers. Now, it's the early 90s. Carl's got to go home. His mother has been murdered, his family has fallen apart and his childhood friends are all heading towards disaster. On his return to the neighborhood, a couple of corrupt cops frame him for homicide. CJ is forced on a journey that takes him across the entire state of San Andreas, to save his family and to take control of the streets. [Rockstar]"
PC,"Nov  5, 2007",Call of Duty 4: Modern Warfare,"['Action', 'Arcade', 'First-Person', 'Modern', 'Shooter']",Activision,92,8.5,"As Call of Duty 4: Modern Warfare's single player campaign unfolds, the player is introduced to new gameplay at every turn – one moment you are fast-roping from your Black Hawk helicopter after storming into the war zone with an armada of choppers, the next you are a sniper, under concealment, in a Ghillie suit miles behind enemy lines, the next you are engaging hostiles from an AC-130 gunship thousands of feet above the battlefield. Mixed with explosive action, Call of Duty 4: Modern Warfare also delivers special effects, including use of depth of field, rim-lighting, character self-shadowing, real time post-processing, texture streaming as well as physics-enabled effects. Infinity Ward deployed a dedicated team from the start to deliver a new level of depth to multiplayer. Building on the hit ""Call of Duty 2"" online experience, Call of Duty 4: Modern Warfare's new multiplayer provides the community an addictive and accessible experience to gamers of all levels. [Activision]"
